{
  "version": 1,
  "lot_id": "a1b2c3d4-e5f6-4a7b-8c9d-0e1f2a3b4c5d",
  "tache_id": 17,
  "utilisateur_id": "u1",
  "intentions": [
    {
      "intention": "lignee",
      "quoi": {
        "texte": "le lemme de compacité",
        "genre": "noeud",
        "type": "lemme"
      }
    }
  ],
  "emis_le": "2026-09-26T10:12:03.120Z"
}
