{
  "version": 1,
  "lot_id": "a1b2c3d4-e5f6-4a7b-8c9d-0e1f2a3b4c5d",
  "tache_id": 17,
  "utilisateur_id": "u1",
  "intentions": [
    {
      "intention": "filtrer",
      "action": "masquer",
      "criteres": {
        "conversation": {
          "texte": "la conversation sur l'énergie",
          "genre": "conversation"
        },
        "statuts": [
          "suspendu",
          "a_verifier"
        ],
        "periode": {
          "debut": "2026-08-01",
          "fin": "2026-08-31"
        }
      }
    }
  ]
}
