{
  "version": 1,
  "lot_id": "a1b2c3d4-e5f6-4a7b-8c9d-0e1f2a3b4c5d",
  "tache_id": 17,
  "utilisateur_id": "u1",
  "intentions": [
    {
      "intention": "tout_voir"
    },
    {
      "intention": "niveau_de_detail",
      "niveau": "plus"
    },
    {
      "intention": "point_de_vue",
      "mode": "3d",
      "vue": "cote"
    },
    {
      "intention": "liens_complets",
      "oui": true
    },
    {
      "intention": "revenir"
    }
  ]
}
